RB-AME274,ASEAN,Medium,Store Manager,Store shelf display demonstration system used by sales reps.,60,Bronze,Cloud,COST,N/A,Internal,2,-,NO,1,,,,
RB-AME275,ASEAN,Medium,PLANET EDI,"Order taking, Daily Invoicing and Monthly Invoicing are on EDI solution via PLANET VAN company.",0,Gold,Custom,AS2,N/A,Internal,2,-,NO,1,,,,
RB-AME276,ASEAN,Medium,Warehouse EDI,"Shipping request, Shipping Confirmation, Item Master information, PO receipt advice are run on EDI solution with MARUZEN warehouse.",0,Gold,Custom,AS2,N/A,Internal,2,-,NO,1,,,,
RB-AME277,ASEAN,Medium,Earth Chemical EDI,"Earth IMS, Shipping, Inventory information and related master data are provided to RB with EDI, and RB provides inventory information to Earth Chemical with EDI. ",0,Silver,Custom,ZENGIN,N/A,Internal / Vendor,2,-,NO,1,,,,
RB-AME278,ASEAN,Medium,Japan Consumption Tax Report on JDE (JP Localization),Consumption Tax reporting system to make tax report to submit to authority.,5,Bronze,Custom,AS400,N/A,Internal / Vendor,2,A7.3.10,NO,1,,,,
RB-AME279,ASEAN,Medium,RBSM,RB One Project - Spend Management,20,Silver,Cloud,COST - RB,N/A,Internal,2,,NO,1,,,,
RB-AME280,ASEAN,Medium,TSM,RB One project - Trade Spend Management,50,Silver,Cloud,COST - RB,N/A,Internal,5,,NO,1,,,,
RB-AME281,ASEAN,Medium,MDM,RB Master Data Management,15,Silver,Cloud,COST - RB,N/A,Internal,5,-,NO,1,,,,
RB-AME282,ASEAN,Medium,NPD Tracker,Used for NPD forecasting and actual analysis on Salesforce.com,50,Bronze,Custom,COST - Salesforce.com,N/A,Internal,5,,NO,1,,,,
RB-AME283,ASEAN,Medium,KINNOSUKE,RBJ attendance record system ,150,Bronze,Cloud,COST - HOYA service,N/A,Internal / Vendor,0,-,NO,1,,,,
RB-AME284,ASEAN,Medium,ShareStage,RBJ FTP site,150,Bronze,Cloud,COST - NTT Communications,N/A,Internal / Vendor,0,-,NO,1,,,,
